{
  "$schema": "./schema/budget-schema.json",
  "metadata": {
    "kommune": "Augsburg",
    "ags": "09761000",
    "jahr": 2024,
    "einwohner": 298972,
    "einwohner_stichtag": "2023-12-31",
    "status": "Nachtrag",
    "waehrung": "EUR",
    "quelle": "Haushaltsplan 2025/2026 der Stadt Augsburg (Band Haushaltssatzung mit Anlagen), Gruppierungsübersicht, Spalte „Ansatz 2024“",
    "hinweis": "Aus der Gruppierungsübersicht des Haushaltsplans (Doppelhaushalt); Untergruppen, die der Gruppierungsplan nicht kennt, sind ihrer Gruppe zugerechnet. Die Spalte „Ansatz 2024“ zeigt den Stand nach dem 2. Nachtragshaushalt 2024. Die gedruckte Summe der Gruppe 65 (Geschäftsausgaben) ist um 100 € höher als ihre Positionen, enthält also eine nicht gedruckte Position; übernommen sind die gedruckten Positionen."
  },
  "kennzahlen": {
    "hebesatz_grundsteuer_a": {
      "wert": 485,
      "quelle": "Stadt Augsburg, Haushaltsplan 2023/2024, Vorbericht (für die Ansatzbildung verwendete Hebesätze; Grundsteuer A, B und Gewerbesteuer unverändert seit 2016)"
    },
    "hebesatz_grundsteuer_b": {
      "wert": 555,
      "quelle": "Stadt Augsburg, Haushaltsplan 2023/2024, Vorbericht (für die Ansatzbildung verwendete Hebesätze; Grundsteuer A, B und Gewerbesteuer unverändert seit 2016)"
    },
    "hebesatz_gewerbesteuer": {
      "wert": 470,
      "quelle": "Stadt Augsburg, Haushaltsplan 2023/2024, Vorbericht (für die Ansatzbildung verwendete Hebesätze; Grundsteuer A, B und Gewerbesteuer unverändert seit 2016)"
    },
    "schulden": {
      "wert": 441867000,
      "stichtag": "2023-12-31",
      "quelle": "Bayerisches Landesamt für Statistik, Staats- und Kommunalschulden in Bayern am 31. Dezember 2023 (Schulden insgesamt ohne Eigenbetriebe, auf 1.000 € gerundet)"
    },
    "kassenkredite_hoechstbetrag": {
      "wert": 167000000,
      "quelle": "Stadt Augsburg, Haushaltssatzung 2023/2024, § 5 Abs. 1"
    }
  },
  "betraege": {
    "vwh": {
      "einnahmen": {
        "000": 178000.0,
        "001": 57800000.0,
        "003": 222754202.0,
        "010": 194000000.0,
        "012": 39000000.0,
        "022": 816000.0,
        "027": 556000.0,
        "041": 204429532.0,
        "051": 100.0,
        "061": 40678121.0,
        "081": 6405074.0,
        "10": 14495957.0,
        "11": 32576341.0,
        "13": 4285362.0,
        "14": 13417254.0,
        "15": 10978977.0,
        "160": 39008077.0,
        "161": 8373278.0,
        "162": 27376015.0,
        "163": 2054594.0,
        "164": 4421854.0,
        "165": 10908459.0,
        "166": 10143977.0,
        "167": 83553.0,
        "168": 2222936.0,
        "169": 3949536.0,
        "170": 8245876.0,
        "171": 122848527.0,
        "172": 185489.0,
        "174": 200000.0,
        "175": 15700.0,
        "176": 6925967.0,
        "177": 20010.0,
        "178": 423210.0,
        "191": 45489421.0,
        "205": 939622.0,
        "207": 8008435.0,
        "208": 2185.0,
        "21": 2076975.0,
        "22": 18283108.0,
        "241": 215400.0,
        "243": 10000.0,
        "245": 325464.0,
        "247": 307475.0,
        "249": 987659.0,
        "251": 1416263.0,
        "255": 351345.0,
        "257": 5000.0,
        "26": 1437947.0,
        "270": 728947.0,
        "275": 646500.0,
        "280": 760691.0,
        "283": 246061.0,
        "286": 30391171.0,
        "287": 435240.0
      },
      "ausgaben": {
        "40": 1843723.0,
        "410": 95393157.0,
        "414": 180942764.0,
        "416": 164428.0,
        "420": 55134960.0,
        "424": 303602.0,
        "434": 16133377.0,
        "444": 35946408.0,
        "448": 64259.0,
        "45": 14207660.0,
        "46": 20332.0,
        "470": 620672.0,
        "50": 15778790.0,
        "51": 22697624.0,
        "52": 9962123.0,
        "53": 31059580.0,
        "54": 27778612.0,
        "55": 1958822.0,
        "56": 3541260.0,
        "57": 1412322.0,
        "63": 38595291.0,
        "638": 10846358.0,
        "639": 3600000.0,
        "64": 4693549.0,
        "65": 12985583.0,
        "660": 35841.0,
        "661": 1419912.0,
        "662": 1233085.0,
        "671": 3160800.0,
        "672": 7421715.0,
        "674": 265100.0,
        "675": 255821.0,
        "676": 4199226.0,
        "677": 130000.0,
        "678": 2115976.0,
        "679": 3949536.0,
        "680": 694947.0,
        "685": 583500.0,
        "690": 63723000.0,
        "691": 460000.0,
        "692": 1232465.0,
        "693": 1000000.0,
        "696": 2701550.0,
        "70": 109275544.0,
        "711": 9724437.0,
        "712": 32739.0,
        "713": 12170093.0,
        "715": 12786698.0,
        "716": 8122762.0,
        "717": 661381.0,
        "718": 29601806.0,
        "728": 123562.0,
        "730": 250000.0,
        "735": 44644536.0,
        "739": 8000.0,
        "740": 1580000.0,
        "75": 18000.0,
        "76": 30523429.0,
        "77": 53484341.0,
        "781": 1530000.0,
        "788": 460360.0,
        "79": 6048485.0,
        "800": 585450.0,
        "801": 1300.0,
        "805": 1095400.0,
        "806": 2253200.0,
        "807": 5855509.0,
        "810": 16588079.0,
        "832": 110077650.0,
        "84": 50.0,
        "850": 4974622.0,
        "851": -4001643.0,
        "860": 72606680.0,
        "863": 53028.0,
        "866": 4714804.0,
        "867": 1161113.0,
        "868": 10000.0
      }
    },
    "vmh": {
      "einnahmen": {
        "300": 72606680.0,
        "303": 53028.0,
        "306": 4714804.0,
        "307": 1161113.0,
        "308": 10000.0,
        "310": 46370194.0,
        "313": 246061.0,
        "316": 30613959.0,
        "317": 2531269.0,
        "325": 536615.0,
        "327": 203410.0,
        "328": 397511.0,
        "33": 235000.0,
        "340": 2850100.0,
        "345": 50400.0,
        "35": 6513000.0,
        "360": 4440783.0,
        "361": 66685398.0,
        "362": 966029.0,
        "365": 137508.0,
        "366": 1043134.0,
        "368": 851956.0,
        "376": 46025800.0,
        "377": 26900000.0
      },
      "ausgaben": {
        "900": 760691.0,
        "903": 246061.0,
        "906": 30391171.0,
        "907": 435240.0,
        "910": 50648982.0,
        "913": 53028.0,
        "916": 7251887.0,
        "917": 1396113.0,
        "927": 1350000.0,
        "928": 308000.0,
        "93": 16590918.0,
        "932": 4131187.0,
        "935": 10919731.0,
        "939": 542000.0,
        "94": 115468960.0,
        "95": 25820898.0,
        "96": 4753314.0,
        "970": 4624240.0,
        "971": 7000.0,
        "975": 3254668.0,
        "976": 23214219.0,
        "977": 16872000.0,
        "982": 966029.0,
        "983": 25000.0,
        "985": 3671135.0,
        "987": 1261998.0,
        "988": 6772200.0
      }
    }
  },
  "nicht_aufgeschluesselt": {
    "vwh": {
      "ausgaben": {
        "63": "weitere Untergruppen der Kommune (630, 631, 633, 635, 637)"
      }
    },
    "vmh": {
      "ausgaben": {
        "93": "weitere Untergruppen der Kommune (930, 934)"
      }
    }
  }
}
