{
  "$schema": "./schema/budget-schema.json",
  "metadata": {
    "kommune": "Augsburg",
    "ags": "09761000",
    "jahr": 2021,
    "einwohner": 295830,
    "einwohner_stichtag": "2020-12-31",
    "status": "Ergebnis",
    "waehrung": "EUR",
    "quelle": "Haushaltsplan 2023/2024 der Stadt Augsburg (Band Haushaltssatzung mit Anlagen), Gruppierungsübersicht, Spalte „Ergebnis 2021“",
    "hinweis": "Aus der Gruppierungsübersicht des Haushaltsplans (Doppelhaushalt); Untergruppen, die der Gruppierungsplan nicht kennt, sind ihrer Gruppe zugerechnet."
  },
  "kennzahlen": {
    "hebesatz_grundsteuer_a": {
      "wert": 485,
      "quelle": "Stadt Augsburg, Haushaltsplan 2023/2024, Vorbericht (für die Ansatzbildung verwendete Hebesätze; Grundsteuer A, B und Gewerbesteuer unverändert seit 2016)"
    },
    "hebesatz_grundsteuer_b": {
      "wert": 555,
      "quelle": "Stadt Augsburg, Haushaltsplan 2023/2024, Vorbericht (für die Ansatzbildung verwendete Hebesätze; Grundsteuer A, B und Gewerbesteuer unverändert seit 2016)"
    },
    "hebesatz_gewerbesteuer": {
      "wert": 470,
      "quelle": "Stadt Augsburg, Haushaltsplan 2023/2024, Vorbericht (für die Ansatzbildung verwendete Hebesätze; Grundsteuer A, B und Gewerbesteuer unverändert seit 2016)"
    }
  },
  "betraege": {
    "vwh": {
      "einnahmen": {
        "000": 178210.88,
        "001": 56188548.05,
        "003": 178767193.54,
        "010": 170672385.0,
        "012": 42245082.0,
        "022": 788422.66,
        "027": 524254.25,
        "041": 179078920.0,
        "061": 50140110.08,
        "081": 4207655.23,
        "10": 12669760.3,
        "11": 27132553.86,
        "13": 3853497.15,
        "14": 11593769.06,
        "15": 8980677.41,
        "160": 26461632.69,
        "161": 8932029.29,
        "162": 24826972.04,
        "163": 1862033.48,
        "164": 3964579.1,
        "165": 8588982.47,
        "166": 9316768.49,
        "167": 141466.9,
        "168": 3615163.56,
        "169": 3141130.67,
        "170": 2132917.61,
        "171": 136660320.66,
        "172": 202951.86,
        "173": 24851.6,
        "174": 846431.57,
        "175": 223817.29,
        "176": 549131.73,
        "177": 155136.37,
        "178": 2769762.74,
        "191": 33915653.5,
        "205": 84449.85,
        "207": 100483.21,
        "208": 3192.06,
        "21": 5009269.41,
        "22": 17502395.02,
        "240": 574.76,
        "241": 222077.32,
        "243": 13690.16,
        "245": 394160.85,
        "247": 365786.57,
        "249": 528204.64,
        "250": -4365.43,
        "251": 1420289.04,
        "254": 3749.94,
        "255": 430903.58,
        "257": 12198.32,
        "258": 75.0,
        "259": 50866.51,
        "26": 3117336.82,
        "270": 707779.3,
        "275": 628540.74,
        "283": 429411.82,
        "286": 4163775.11,
        "287": 246840.98
      },
      "ausgaben": {
        "40": 1980752.78,
        "410": 80967901.85,
        "411": 70000.0,
        "414": 147663711.78,
        "416": 53743.0,
        "420": 50050728.19,
        "424": 325424.49,
        "434": 11777456.74,
        "440": -49.27,
        "444": 30670424.0,
        "448": 25863.85,
        "45": 12633619.99,
        "46": 18193.62,
        "50": 12073695.23,
        "51": 23159648.97,
        "52": 7759698.72,
        "53": 21728938.13,
        "54": 19564047.44,
        "55": 1643985.85,
        "56": 2399861.91,
        "57": 1081108.69,
        "63": 60323057.87,
        "638": 8059476.75,
        "639": 3131314.86,
        "64": 3859510.72,
        "65": 9395799.51,
        "660": 30418.7,
        "661": 1042491.03,
        "662": 32104.11,
        "671": 3283074.87,
        "672": 8484871.43,
        "673": 26751.01,
        "674": 793070.68,
        "675": 84393.3,
        "676": 3402869.62,
        "677": 96827.34,
        "678": 1770331.23,
        "679": 3141379.56,
        "680": 707779.3,
        "685": 628540.74,
        "690": 48333311.84,
        "691": 322909.19,
        "692": 598237.38,
        "693": 930981.4,
        "696": 1402927.2,
        "70": 96739183.35,
        "711": 7684738.87,
        "712": 58557.84,
        "713": 11798909.98,
        "715": 14234482.25,
        "716": 7942232.42,
        "717": 546549.41,
        "718": 24182933.04,
        "728": 134767.0,
        "730": 171082.22,
        "735": 30439427.01,
        "739": 8196.68,
        "740": 882879.05,
        "75": 14894.71,
        "76": 21584448.22,
        "77": 38967484.55,
        "781": 692664.13,
        "788": 997857.16,
        "79": 5780095.12,
        "800": 617036.45,
        "801": 1820.02,
        "805": 51613.34,
        "806": 2864549.58,
        "807": 3933647.3,
        "810": 14345663.0,
        "832": 101482858.0,
        "84": 794324.08,
        "860": 71322871.67,
        "863": 95002.61,
        "865": 70000.0,
        "866": 16974680.1,
        "867": 1026596.92,
        "868": 2018.6
      }
    },
    "vmh": {
      "einnahmen": {
        "300": 71322871.67,
        "303": 95002.61,
        "305": 70000.0,
        "306": 16974680.1,
        "307": 1026596.92,
        "308": 2018.6,
        "310": 42789215.87,
        "313": 429411.82,
        "316": 6209295.54,
        "317": 282823.66,
        "325": 545099.09,
        "327": 209748.49,
        "328": 743918.78,
        "340": 5097881.38,
        "345": 331590.18,
        "35": 5603215.35,
        "360": 1428591.36,
        "361": 32307018.83,
        "362": 549869.99,
        "365": 1207385.44,
        "367": -20000.0,
        "368": 580208.08,
        "370": 3447000.0,
        "376": 1811814.45,
        "377": 33076750.0
      },
      "ausgaben": {
        "903": 429411.82,
        "906": 4163775.11,
        "907": 246840.98,
        "910": 30988367.88,
        "913": 95002.61,
        "915": 70000.0,
        "916": 17082247.82,
        "917": 1026596.92,
        "927": 1110000.0,
        "928": 1611186.0,
        "93": 15488737.13,
        "932": 3733037.77,
        "935": 11189662.76,
        "939": 297897.0,
        "94": 74748535.73,
        "95": 15373166.7,
        "96": 8353924.15,
        "970": 3898903.62,
        "971": 12355.94,
        "975": 1156869.12,
        "976": 28307805.01,
        "977": 9191040.14,
        "981": 316799.29,
        "982": 3250.01,
        "983": 25000.0,
        "985": 4465221.44,
        "986": 157250.0,
        "987": 1136076.83,
        "988": 6663643.96
      }
    }
  },
  "nicht_aufgeschluesselt": {
    "vwh": {
      "ausgaben": {
        "63": "weitere Untergruppen der Kommune (630, 631, 633, 635)"
      }
    },
    "vmh": {
      "ausgaben": {
        "93": "weitere Untergruppen der Kommune (934)"
      }
    }
  }
}
