{
  "$schema": "./schema/budget-schema.json",
  "metadata": {
    "kommune": "Haar",
    "ags": "09184123",
    "jahr": 2023,
    "einwohner": 21979,
    "einwohner_stichtag": "2022-12-31",
    "status": "Ergebnis",
    "waehrung": "EUR",
    "quelle": "Haushaltsplan 2025 der Gemeinde Haar, Einzelpläne (Ratsinformationssystem, Stadtratssitzung vom 26.11.2024), Spalte „Rechnungsergebnis 2023“",
    "hinweis": "Aus den Einzelplänen nach Gruppierung summiert; Untergruppen, die der Gruppierungsplan nicht kennt, sind ihrer Gruppe zugerechnet."
  },
  "kennzahlen": {
    "hebesatz_grundsteuer_a": {
      "wert": 310,
      "quelle": "Gemeinde Haar, Haushaltssatzung 2023 (Beschluss des Gemeinderats vom 29.11.2022), § 4"
    },
    "hebesatz_grundsteuer_b": {
      "wert": 310,
      "quelle": "Gemeinde Haar, Haushaltssatzung 2023 (Beschluss des Gemeinderats vom 29.11.2022), § 4"
    },
    "hebesatz_gewerbesteuer": {
      "wert": 350,
      "quelle": "Gemeinde Haar, Haushaltssatzung 2023 (Beschluss des Gemeinderats vom 29.11.2022), § 4"
    },
    "schulden": {
      "wert": 18523000,
      "stichtag": "2022-12-31",
      "quelle": "Bayerisches Landesamt für Statistik, Staats- und Kommunalschulden in Bayern am 31. Dezember 2023 (Schulden insgesamt ohne Eigenbetriebe, auf 1.000 € gerundet)"
    },
    "kassenkredite_hoechstbetrag": {
      "wert": 1000000,
      "quelle": "Gemeinde Haar, Haushaltssatzung 2023, § 5"
    }
  },
  "betraege": {
    "vwh": {
      "einnahmen": {
        "000": 17177.98,
        "001": 2405756.56,
        "003": 2179769.86,
        "010": 17853889.0,
        "012": 2547201.0,
        "022": 61479.72,
        "061": 2255140.02,
        "10": 425377.06,
        "11": 4397050.2,
        "13": 163331.26,
        "14": 5186639.48,
        "15": 1105816.42,
        "161": 12597.17,
        "162": 215072.31,
        "163": 320041.72,
        "164": 101596.2,
        "165": 53408.86,
        "166": 37017.5,
        "167": 80824.18,
        "168": 41809.42,
        "169": 3773208.39,
        "170": 30716.08,
        "171": 6207209.05,
        "172": 5000.0,
        "175": 49369.0,
        "177": 13729.76,
        "178": 47519.64,
        "205": 36401.34,
        "206": 676862.77,
        "207": 532065.4,
        "21": 757575.0,
        "22": 666561.14,
        "26": 53076.13,
        "270": 1212262.1,
        "271": 28457.36,
        "275": 1888069.78,
        "280": 22377634.32,
        "283": 382523.54
      },
      "ausgaben": {
        "40": 138193.33,
        "410": 866110.67,
        "414": 12564229.89,
        "416": 2752.15,
        "430": 508800.0,
        "434": 951116.78,
        "444": 2476355.44,
        "448": 4422.98,
        "45": 151175.59,
        "46": 70056.73,
        "50": 3126265.4,
        "51": 609210.89,
        "52": 402972.06,
        "53": 674311.96,
        "54": 3125295.29,
        "55": 391082.81,
        "56": 280376.15,
        "57": 1178857.25,
        "59": 7712.49,
        "60": 257868.21,
        "61": 26804.06,
        "62": 85242.7,
        "63": 2948346.87,
        "638": 457072.11,
        "639": 88607.4,
        "64": 1370267.19,
        "65": 943944.34,
        "660": 2102.26,
        "661": 68592.26,
        "670": 10328.96,
        "671": 66925.0,
        "672": 426461.66,
        "676": 499981.94,
        "679": 3773208.39,
        "680": 1212262.1,
        "681": 28457.36,
        "685": 1888069.78,
        "70": 10949817.62,
        "711": 39124.0,
        "717": 139.81,
        "718": 356254.34,
        "723": 9052.8,
        "788": 156037.47,
        "806": 155035.76,
        "807": 6825.0,
        "808": 4367.08,
        "810": -841321.0,
        "832": 26034287.52,
        "84": 191455.38
      }
    },
    "vmh": {
      "einnahmen": {
        "310": 30754228.56,
        "313": 382523.54,
        "325": 538451.96,
        "326": 68256.17,
        "327": 51127.5,
        "340": 5000.0,
        "345": 9630.86,
        "360": -196400.0,
        "361": -239996.01,
        "367": 1162788.32
      },
      "ausgaben": {
        "900": 22377634.32,
        "903": 382523.54,
        "93": 2140124.25,
        "932": 1000000.0,
        "935": 839534.89,
        "936": 3768.36,
        "94": 4883047.9,
        "95": 1701895.4,
        "96": 498571.54,
        "976": 714962.1,
        "978": 11754.0,
        "983": -169166.6,
        "986": -18017.01,
        "988": 12281.46
      }
    }
  },
  "nicht_aufgeschluesselt": {
    "vwh": {
      "ausgaben": {
        "63": "weitere Untergruppen der Kommune (630, 632, 633, 634, 635, 636, 637)"
      }
    },
    "vmh": {
      "ausgaben": {
        "93": "weitere Untergruppen der Kommune (934)"
      }
    }
  }
}
