{
  "$schema": "./schema/budget-schema.json",
  "metadata": {
    "kommune": "Augsburg",
    "ags": "09761000",
    "jahr": 2022,
    "einwohner": 296478,
    "einwohner_stichtag": "2021-12-31",
    "status": "Ergebnis",
    "waehrung": "EUR",
    "quelle": "Haushaltsplan 2025/2026 der Stadt Augsburg (Band Haushaltssatzung mit Anlagen), Gruppierungsübersicht, Spalte „Ergebnis 2022“",
    "hinweis": "Aus der Gruppierungsübersicht des Haushaltsplans (Doppelhaushalt); Untergruppen, die der Gruppierungsplan nicht kennt, sind ihrer Gruppe zugerechnet. Die gedruckte Summe der Gruppe 40 (1.434.520,47 €) liegt um 168.565,00 € unter ihrer einzigen gedruckten Position 4001.01, enthält also eine nicht gedruckte Buchung; übernommen sind die gedruckten Positionen."
  },
  "kennzahlen": {
    "hebesatz_grundsteuer_a": {
      "wert": 485,
      "quelle": "Stadt Augsburg, Haushaltsplan 2023/2024, Vorbericht (für die Ansatzbildung verwendete Hebesätze; Grundsteuer A, B und Gewerbesteuer unverändert seit 2016)"
    },
    "hebesatz_grundsteuer_b": {
      "wert": 555,
      "quelle": "Stadt Augsburg, Haushaltsplan 2023/2024, Vorbericht (für die Ansatzbildung verwendete Hebesätze; Grundsteuer A, B und Gewerbesteuer unverändert seit 2016)"
    },
    "hebesatz_gewerbesteuer": {
      "wert": 470,
      "quelle": "Stadt Augsburg, Haushaltsplan 2023/2024, Vorbericht (für die Ansatzbildung verwendete Hebesätze; Grundsteuer A, B und Gewerbesteuer unverändert seit 2016)"
    },
    "schulden": {
      "wert": 395645000,
      "stichtag": "2021-12-31",
      "quelle": "Bayerisches Landesamt für Statistik, Staats- und Kommunalschulden in Bayern am 31. Dezember 2022 (Schulden insgesamt ohne Eigenbetriebe, auf 1.000 € gerundet)"
    }
  },
  "betraege": {
    "vwh": {
      "einnahmen": {
        "000": 174941.04,
        "001": 56459213.51,
        "003": 220313676.37,
        "010": 174649215.0,
        "012": 38257989.0,
        "022": 816816.27,
        "027": 547115.24,
        "041": 179075284.0,
        "061": 48770788.1,
        "081": 6229661.64,
        "10": 13274040.99,
        "11": 31129214.48,
        "13": 4753166.15,
        "14": 13118017.79,
        "15": 8136321.74,
        "160": 30105174.09,
        "161": 13755963.57,
        "162": 26276483.66,
        "163": 1785658.52,
        "164": 4647567.84,
        "165": 9376035.5,
        "166": 9015562.05,
        "167": 250319.28,
        "168": 3729082.42,
        "169": 3433765.05,
        "170": 2089340.38,
        "171": 135888568.25,
        "172": 185262.2,
        "173": 41663.56,
        "174": 766935.08,
        "175": 330021.42,
        "176": 538839.14,
        "177": 182911.83,
        "178": 1866068.09,
        "191": 31611359.13,
        "205": 95135.4,
        "207": 347923.01,
        "208": 2694.24,
        "21": 6134790.68,
        "22": 18258568.15,
        "240": 2492.8,
        "241": 2240834.29,
        "243": 8179.32,
        "245": 392724.04,
        "247": 591479.34,
        "249": 901331.95,
        "251": 2538600.2,
        "254": 1722.36,
        "255": 458507.24,
        "256": -528.59,
        "257": 18996.29,
        "258": 16.97,
        "259": 157680.46,
        "26": 4080863.18,
        "270": 729446.92,
        "275": 580572.34,
        "280": 873773.64,
        "283": 492610.26,
        "286": 19939610.22,
        "287": 272547.18
      },
      "ausgaben": {
        "40": 1603085.47,
        "410": 84269680.54,
        "411": 280000.0,
        "414": 155931243.78,
        "416": 109543.59,
        "420": 50849151.29,
        "424": 304584.02,
        "434": 12425067.55,
        "444": 32130225.58,
        "448": 63360.72,
        "45": 13300914.01,
        "46": 18376.84,
        "50": 13767905.17,
        "51": 22907903.97,
        "52": 12639664.43,
        "53": 25701072.95,
        "54": 21859507.04,
        "55": 2029938.78,
        "56": 2878061.49,
        "57": 1132435.72,
        "63": 66360568.39,
        "638": 9646761.22,
        "639": 3864021.0,
        "64": 3876685.57,
        "65": 10694438.76,
        "660": 28066.64,
        "661": 1062997.82,
        "662": 134499.21,
        "671": 3118823.64,
        "672": 8792342.31,
        "673": 37306.0,
        "674": 213048.62,
        "675": 114811.65,
        "676": 3671390.31,
        "677": 106029.68,
        "678": 2044285.87,
        "679": 3375448.47,
        "680": 729446.92,
        "685": 580572.34,
        "690": 47957186.62,
        "691": 179929.68,
        "692": 727348.51,
        "693": 985673.23,
        "696": 1883584.27,
        "70": 97898105.24,
        "711": 7510152.0,
        "712": 59658.57,
        "713": 12377892.02,
        "715": 16652800.43,
        "716": 7958810.08,
        "717": 609438.87,
        "718": 26134771.61,
        "728": 131502.0,
        "730": 171632.93,
        "735": 33536229.54,
        "739": 15713.68,
        "740": 969131.04,
        "75": 9082.0,
        "76": 22779701.64,
        "77": 42610274.32,
        "781": 1144137.99,
        "788": 905332.17,
        "79": 9709255.26,
        "800": 553978.26,
        "801": 1624.37,
        "805": 37828.32,
        "806": 2622573.8,
        "807": 2645644.31,
        "810": 15907964.0,
        "832": 110675646.0,
        "84": 575711.62,
        "860": 86914341.11,
        "863": 74216.85,
        "865": 280000.0,
        "866": 17331203.2,
        "867": 1152022.72,
        "868": 38595.87
      }
    },
    "vmh": {
      "einnahmen": {
        "300": 86914341.11,
        "303": 74216.85,
        "305": 280000.0,
        "306": 17331203.2,
        "307": 1152022.72,
        "308": 38595.87,
        "310": 21572425.98,
        "313": 492610.26,
        "316": 20907750.07,
        "317": 1346780.02,
        "325": 641586.64,
        "327": 209278.59,
        "328": 545160.99,
        "340": 5611169.69,
        "345": 255207.52,
        "35": 5325209.69,
        "360": 1776895.5,
        "361": 32423885.05,
        "362": -189241.0,
        "365": 557103.46,
        "368": 332815.76,
        "370": 1009000.0,
        "375": 10000000.0,
        "376": 69450000.0,
        "377": 13024388.09
      },
      "ausgaben": {
        "900": 873773.64,
        "903": 492610.26,
        "906": 19939610.22,
        "907": 272547.18,
        "910": 74808877.7,
        "913": 74216.85,
        "915": 280000.0,
        "916": 21762891.87,
        "917": 1152022.72,
        "927": 975000.0,
        "928": 211256.0,
        "93": 15796812.51,
        "932": 4367796.31,
        "935": 10698857.77,
        "939": 608660.0,
        "94": 63681238.66,
        "95": 21238950.73,
        "96": 18264046.66,
        "970": 4779948.92,
        "971": 11831.58,
        "975": 1167246.52,
        "976": 22973736.32,
        "977": 11188872.01,
        "981": 105100.0,
        "983": 20000.0,
        "985": 2802074.38,
        "986": -307250.0,
        "987": 923457.0,
        "988": 7593534.33
      }
    }
  },
  "nicht_aufgeschluesselt": {
    "vwh": {
      "ausgaben": {
        "63": "weitere Untergruppen der Kommune (630, 631, 633, 635)"
      }
    },
    "vmh": {
      "ausgaben": {
        "93": "weitere Untergruppen der Kommune (934)"
      }
    }
  }
}
